{"schema_version":"zcr/1","request_id":"req-1","workspace_id":"11111111111111111111111111111111:22222222222222222222222222222222","generation":7,"ok":true,"complete":false,"truncated":true,"consistency":"checked_live","coverage":{"scope":"requested_files","skipped":5,"index_state":"live","reasons":["some items failed; see their errors","serialized data reached output_bytes"]},"data":{"items":[{"item_id":"item-0","ok":true,"data":{"path":"f00.txt","lines":[{"number":1,"start":0,"end":11,"text":"f00 line 1\n"},{"number":2,"start":11,"end":22,"text":"f00 line 2\n"},{"number":3,"start":22,"end":33,"text":"f00 line 3\n"}],"version":{"size":351,"file_id":"16777231:648158890","sha256":null}},"error":null},{"item_id":"item-1","ok":true,"data":{"path":"f01.txt","lines":[{"number":2,"start":11,"end":22,"text":"f01 line 2\n"},{"number":3,"start":22,"end":33,"text":"f01 line 3\n"},{"number":4,"start":33,"end":44,"text":"f01 line 4\n"},{"number":5,"start":44,"end":55,"text":"f01 line 5\n"}],"version":{"size":351,"file_id":"16777231:648158891","sha256":null}},"error":null},{"item_id":"item-2","ok":true,"data":{"path":"f02.txt","lines":[{"number":3,"start":22,"end":33,"text":"f02 line 3\n"},{"number":4,"start":33,"end":44,"text":"f02 line 4\n"},{"number":5,"start":44,"end":55,"text":"f02 line 5\n"},{"number":6,"start":55,"end":66,"text":"f02 line 6\n"},{"number":7,"start":66,"end":77,"text":"f02 line 7\n"}],"version":{"size":351,"file_id":"16777231:648158892","sha256":null}},"error":null},{"item_id":"item-3","ok":true,"data":{"path":"f03.txt","lines":[{"number":4,"start":33,"end":44,"text":"f03 line 4\n"},{"number":5,"start":44,"end":55,"text":"f03 line 5\n"},{"number":6,"start":55,"end":66,"text":"f03 line 6\n"},{"number":7,"start":66,"end":77,"text":"f03 line 7\n"},{"number":8,"start":77,"end":88,"text":"f03 line 8\n"},{"number":9,"start":88,"end":99,"text":"f03 line 9\n"}],"version":{"size":351,"file_id":"16777231:648158893","sha256":null}},"error":null},{"item_id":"item-4","ok":true,"data":{"path":"f04.txt","lines":[{"number":5,"start":44,"end":55,"text":"f04 line 5\n"},{"number":6,"start":55,"end":66,"text":"f04 line 6\n"},{"number":7,"start":66,"end":77,"text":"f04 line 7\n"},{"number":8,"start":77,"end":88,"text":"f04 line 8\n"},{"number":9,"start":88,"end":99,"text":"f04 line 9\n"},{"number":10,"start":99,"end":111,"text":"f04 line 10\n"},{"number":11,"start":111,"end":123,"text":"f04 line 11\n"}],"version":{"size":351,"file_id":"16777231:648158894","sha256":null}},"error":null},{"item_id":"item-5","ok":true,"data":{"path":"f05.txt","lines":[{"number":1,"start":0,"end":11,"text":"f05 line 1\n"},{"number":2,"start":11,"end":22,"text":"f05 line 2\n"},{"number":3,"start":22,"end":33,"text":"f05 line 3\n"},{"number":4,"start":33,"end":44,"text":"f05 line 4\n"},{"number":5,"start":44,"end":55,"text":"f05 line 5\n"},{"number":6,"start":55,"end":66,"text":"f05 line 6\n"},{"number":7,"start":66,"end":77,"text":"f05 line 7\n"},{"number":8,"start":77,"end":88,"text":"f05 line 8\n"}],"version":{"size":351,"file_id":"16777231:648158895","sha256":null}},"error":null},{"item_id":"item-6","ok":true,"data":{"path":"f06.txt","lines":[{"number":2,"start":11,"end":22,"text":"f06 line 2\n"},{"number":3,"start":22,"end":33,"text":"f06 line 3\n"},{"number":4,"start":33,"end":44,"text":"f06 line 4\n"},{"number":5,"start":44,"end":55,"text":"f06 line 5\n"},{"number":6,"start":55,"end":66,"text":"f06 line 6\n"},{"number":7,"start":66,"end":77,"text":"f06 line 7\n"},{"number":8,"start":77,"end":88,"text":"f06 line 8\n"},{"number":9,"start":88,"end":99,"text":"f06 line 9\n"},{"number":10,"start":99,"end":111,"text":"f06 line 10\n"}],"version":{"size":351,"file_id":"16777231:648158896","sha256":null}},"error":null},{"item_id":"item-7","ok":true,"data":{"path":"f07.txt","lines":[{"number":3,"start":22,"end":33,"text":"f07 line 3\n"},{"number":4,"start":33,"end":44,"text":"f07 line 4\n"},{"number":5,"start":44,"end":55,"text":"f07 line 5\n"}],"version":{"size":351,"file_id":"16777231:648158897","sha256":null}},"error":null},{"item_id":"item-8","ok":true,"data":{"path":"f08.txt","lines":[{"number":4,"start":33,"end":44,"text":"f08 line 4\n"},{"number":5,"start":44,"end":55,"text":"f08 line 5\n"},{"number":6,"start":55,"end":66,"text":"f08 line 6\n"},{"number":7,"start":66,"end":77,"text":"f08 line 7\n"}],"version":{"size":351,"file_id":"16777231:648158898","sha256":null}},"error":null},{"item_id":"item-9","ok":true,"data":{"path":"f09.txt","lines":[{"number":5,"start":44,"end":55,"text":"f09 line 5\n"},{"number":6,"start":55,"end":66,"text":"f09 line 6\n"},{"number":7,"start":66,"end":77,"text":"f09 line 7\n"},{"number":8,"start":77,"end":88,"text":"f09 line 8\n"},{"number":9,"start":88,"end":99,"text":"f09 line 9\n"}],"version":{"size":351,"file_id":"16777231:648158899","sha256":null}},"error":null},{"item_id":"item-10","ok":false,"data":null,"error":{"code":"E_OUTPUT_BUDGET","message":"item does not fit the remaining batch output_bytes","retryable":false}},{"item_id":"item-11","ok":false,"data":null,"error":{"code":"E_OUTPUT_BUDGET","message":"item does not fit the remaining batch output_bytes","retryable":false}},{"item_id":"item-12","ok":false,"data":null,"error":{"code":"E_OUTPUT_BUDGET","message":"item does not fit the remaining batch output_bytes","retryable":false}},{"item_id":"item-13","ok":false,"data":null,"error":{"code":"E_OUTPUT_BUDGET","message":"item does not fit the remaining batch output_bytes","retryable":false}},{"item_id":"item-14","ok":true,"data":{"path":"f14.txt","lines":[{"number":5,"start":44,"end":55,"text":"f14 line 5\n"},{"number":6,"start":55,"end":66,"text":"f14 line 6\n"},{"number":7,"start":66,"end":77,"text":"f14 line 7\n"}],"version":{"size":351,"file_id":"16777231:648158905","sha256":null}},"error":null},{"item_id":"item-15","ok":false,"data":null,"error":{"code":"E_OUTPUT_BUDGET","message":"item does not fit the remaining batch output_bytes","retryable":false}},{"item_id":"item-16","ok":false,"data":null,"error":{"code":"E_OUTPUT_BUDGET","message":"item does not fit the remaining batch output_bytes","retryable":false}},{"item_id":"item-17","ok":false,"data":null,"error":{"code":"E_OUTPUT_BUDGET","message":"item does not fit the remaining batch output_bytes","retryable":false}},{"item_id":"item-18","ok":false,"data":null,"error":{"code":"E_OUTPUT_BUDGET","message":"item does not fit the remaining batch output_bytes","retryable":false}},{"item_id":"item-19","ok":false,"data":null,"error":{"code":"E_OUTPUT_BUDGET","message":"item does not fit the remaining batch output_bytes","retryable":false}},{"item_id":"dup-3","ok":false,"data":null,"error":{"code":"E_OUTPUT_BUDGET","message":"item does not fit the remaining batch output_bytes","retryable":false}},{"item_id":"overlap-3","ok":false,"data":null,"error":{"code":"E_OUTPUT_BUDGET","message":"item does not fit the remaining batch output_bytes","retryable":false}},{"item_id":"missing","ok":false,"data":null,"error":{"code":"E_NOT_FOUND","message":"file not found","retryable":false}},{"item_id":"directory","ok":false,"data":null,"error":{"code":"E_NOT_REGULAR","message":"not a regular file","retryable":false}},{"item_id":"hash-5","ok":false,"data":null,"error":{"code":"E_OUTPUT_BUDGET","message":"item does not fit the remaining batch output_bytes","retryable":false}},{"item_id":"tail-19","ok":false,"data":null,"error":{"code":"E_OUTPUT_BUDGET","message":"item does not fit the remaining batch output_bytes","retryable":false}},{"item_id":"past-eof-7","ok":true,"data":{"path":"f07.txt","lines":[],"version":{"size":351,"file_id":"16777231:648158897","sha256":null}},"error":null},{"item_id":"crlf","ok":true,"data":{"path":"crlf.txt","lines":[{"number":1,"start":0,"end":3,"text":"a\r\n"},{"number":2,"start":3,"end":6,"text":"b\r\n"},{"number":3,"start":6,"end":9,"text":"c\r\n"}],"version":{"size":9,"file_id":"16777231:648158912","sha256":null}},"error":null},{"item_id":"invalid-utf8","ok":false,"data":null,"error":{"code":"E_UNSUPPORTED","message":"unsupported consistency or file content","retryable":false}},{"item_id":"missing-again","ok":false,"data":null,"error":{"code":"E_NOT_FOUND","message":"file not found","retryable":false}},{"item_id":"tiny-output","ok":false,"data":null,"error":{"code":"E_OUTPUT_BUDGET","message":"first line exceeds the item's output_bytes","retryable":false}},{"item_id":"truncated-1","ok":false,"data":null,"error":{"code":"E_OUTPUT_BUDGET","message":"item does not fit the remaining batch output_bytes","retryable":false}}]},"error":null,"meta":{"returned_bytes":8163}}