{"schema_version":"zcr/1","request_id":"req-1","workspace_id":"11111111111111111111111111111111:22222222222222222222222222222222","generation":7,"ok":true,"complete":true,"truncated":false,"consistency":"checked_live","coverage":{"scope":"f00.txt","skipped":0,"index_state":"live"},"data":{"path":"f00.txt","lines":[{"number":1,"start":0,"end":11,"text":"f00 line 1\n"},{"number":2,"start":11,"end":22,"text":"f00 line 2\n"},{"number":3,"start":22,"end":33,"text":"f00 line 3\n"}],"version":{"size":351,"file_id":"16777231:648158890","sha256":null}},"error":null,"meta":{"returned_bytes":260}}